{
  "baseline_scope_sha256": "9bea33a672f0d2043e19e706e4d67cd8537823ad47154242916422c53c7aeb7f",
  "canonical_files": [
    {
      "path": "data/canonical/claims/m7-house-roberts.json",
      "sha256": "7d7a669726f9ec3f847780e73ad82834b96d4fdafbd75f7793451822e3c660c9"
    },
    {
      "path": "data/canonical/claims/m8a-progression.json",
      "sha256": "b41d159886deaaf32e7a317f38362d22110b6af1405df69e7d895b12d9aa6ad9"
    },
    {
      "path": "data/canonical/claims/m8b-equipment.json",
      "sha256": "3bdb518a3fa3a138edef31e5e1306f644cd9605ce4953d5c18235cab0db898a8"
    },
    {
      "path": "data/canonical/claims/r01-equipment-database.json",
      "sha256": "7c778a34f069096844fde3f5179cd055eeb1591d6cf9fcc54b2cd6e3b7cc1879"
    },
    {
      "path": "data/canonical/entities/m7-house-roberts.json",
      "sha256": "4b4d1d6ba61f4e1321de43f539b9042331d9b4a7a13a70d902045df0c706592a"
    },
    {
      "path": "data/canonical/entities/m8b-equipment.json",
      "sha256": "ce6ed10a2823a77a5b15dbe28e61a6d48fab4848dc92bd4644c654e9d69d74ad"
    },
    {
      "path": "data/canonical/evidence/g02-official-catchup.json",
      "sha256": "3fe7ff0c813463c2bcdf78c81f94d38153c65bbd9e2d0b9d362aa07411b269bc"
    },
    {
      "path": "data/canonical/evidence/m7-house-roberts.json",
      "sha256": "7643d3b8c70f7c61f36240c817ccb582819a7bb86fd2911726c2b4b9db0527bb"
    },
    {
      "path": "data/canonical/evidence/m8a-progression.json",
      "sha256": "7f2b09ad7e756a164e0ee9c709f8536ee6fcc8d61a786eea22699966721a2f32"
    },
    {
      "path": "data/canonical/evidence/m8b-equipment.json",
      "sha256": "17cc196f31bcb6a8513d71204879a8d24485c576b749d21b2f8d408613bc26a0"
    },
    {
      "path": "data/canonical/evidence/r01-equipment-database.json",
      "sha256": "e2aee03faeb17c06f2da50067f3b2aa98be785219f210c70e32a2d20beb4b4d9"
    },
    {
      "path": "data/canonical/patches/g02-official-catchup.json",
      "sha256": "b99cde6a7a6c744b903311583315e6c7736b773694d6b132bb864078bce1a1d8"
    },
    {
      "path": "data/canonical/receipts/g02-official-catchup.json",
      "sha256": "d34447dc1ae97280b4dd0f3ff262eb118d93a1d07a65e60b4790bc02c7535492"
    },
    {
      "path": "data/canonical/receipts/m7-house-roberts.json",
      "sha256": "fca2eea55af93ab323b63984c451df96ed7c933fb0bf47f78133264418ce9181"
    },
    {
      "path": "data/canonical/receipts/m8a-progression.json",
      "sha256": "a7059b71c3bbf3d1cc147462c76094d81a17b57b2471c231d9af8d38b1f5b807"
    },
    {
      "path": "data/canonical/receipts/m8b-equipment.json",
      "sha256": "407e4d8d4f6d70e400265a977ffd913e3a72d14650ce6922950696b38e0e0c67"
    },
    {
      "path": "data/canonical/receipts/r01-equipment-database.json",
      "sha256": "01ea1b36d3b98deb59c9fe14565b5b0c7c068bb95158e506bf428e0fb68815fd"
    },
    {
      "path": "data/vocabulary/predicates.json",
      "sha256": "79a2a9ebf9902cc97f7fcac1e9000ebe39aae65677a3cdbd5b1e560d0186a8d4"
    }
  ],
  "evidence_cutoff": "2026-09-11",
  "record_ids": {
    "claims": [
      "clm_46f71b753dd5a51e961ec6df",
      "clm_4895dac9d99f17dc7737aae8",
      "clm_4b07160062124fd0a550d66d",
      "clm_5331d0c7c8d821bd1c38dbfd",
      "clm_61908f7c6ef0b5081a7d0b86",
      "clm_6587be1e5f5281209b71e32f",
      "clm_6974a88ce5d2afad27b63ece",
      "clm_6a1915da2622feb109386602",
      "clm_72d9b8c563c53c1d61c2c520",
      "clm_919f909750542ddfad4c31c2",
      "clm_9bb514c6e8d13fadc66857f2",
      "clm_aa0e6cb8788134c8f514b6ae",
      "clm_b142f3a943e858ea4542b9fb",
      "clm_c0cbb7084ee56a37df11442a",
      "clm_c955ecfdc92911611af8af74",
      "clm_ec8afb8224797de2719059d7",
      "clm_fdcd9b131afdc5ce1dd0b550",
      "clm_m8ahonoralliance2026091001",
      "clm_m8ahonorazurite2026091001",
      "clm_m8ahonorbloodstone2026091001",
      "clm_m8ahonorcontrib2026091001",
      "clm_m8ahonorearring2026091001",
      "clm_m8asealednoitem2026091001",
      "clm_m8asealedprereq2026091001",
      "clm_m8astolencontrib2026091001",
      "clm_m8astolendrill2026091001",
      "clm_m8astolenmap2026091001",
      "clm_m8astolenprereq2026091001",
      "clm_m8atrialcontrib2026091001",
      "clm_m8atrialentry2026091001",
      "clm_m8bringacquisition2026091001",
      "clm_m8bringcategory2026091001",
      "clm_m8bringspeed2026091001",
      "clm_m8bringstamina2026091001",
      "clm_m8bswordacquisition2026091001",
      "clm_m8bswordcategory2026091001",
      "clm_m8bswordcrit2026091001",
      "clm_m8bswordgears2026091001",
      "clm_m8bswordspeed2026091001",
      "clm_r01ringattack05",
      "clm_r01ringattack10",
      "clm_r01ringquest",
      "clm_r01ringspeed05",
      "clm_r01ringspeed10",
      "clm_r01ringstaminameaning",
      "clm_r01ringvendor",
      "clm_r01swordattack05",
      "clm_r01swordattack10",
      "clm_r01swordcritical05",
      "clm_r01swordcritical10",
      "clm_r01swordvendor"
    ],
    "entities": [
      "ent_089ced07950ace8407a29247",
      "ent_2beedf6ea02e8ba696464bb3",
      "ent_6ca283919bf4d6fa26a0da9f",
      "ent_6dd97bc94c6fe241d0bb1a0e",
      "ent_7ea2ae660f60d58012dcb3a7",
      "ent_87a65ae57efbb95fe75d068c",
      "ent_d1b3b818dfa863a35aab7680",
      "ent_d3de309d4578b75dc73ee5f2",
      "ent_m8brighteousverdict0001",
      "ent_m8bwitchsring0000001"
    ],
    "evidence": [
      "evd_43cf07ba816dbe19d270d124",
      "evd_db435362e5eb93eba7f3eac4",
      "evd_g02notice0730001",
      "evd_g02notice0740001",
      "evd_g02notice0750001",
      "evd_g02notice0800001",
      "evd_g02notice1090001",
      "evd_g02notice1100001",
      "evd_g02notice1110001",
      "evd_g02notice1120001",
      "evd_g02notice1140001",
      "evd_g02notice1150001",
      "evd_g02notice1160001",
      "evd_g02notice1170001",
      "evd_g02notice1190001",
      "evd_g02notice1200001",
      "evd_g02notice1230001",
      "evd_g02notice1260001",
      "evd_g02notice1270001",
      "evd_g02notice1280001",
      "evd_m8aconsolepulse2026091001",
      "evd_m8asealedguide2026091001",
      "evd_m8avulkk2026091001",
      "evd_m8bconsolepulse2026091001",
      "evd_m8bpromaxrings2026091001",
      "evd_m8bringsguide2026091001",
      "evd_r01crimsondbsword0001",
      "evd_r01toolsring0001",
      "evd_r01toolssword0001"
    ],
    "patchChanges": [],
    "patchReviews": [],
    "patches": [
      "pat_g02patch100030001",
      "pat_g02patch100040001",
      "pat_g02patch102000001",
      "pat_g02patch115000001",
      "pat_g02patch116000001",
      "pat_g02patch116010001",
      "pat_g02patch116020001",
      "pat_g02patch116030001",
      "pat_g02patch116040001",
      "pat_g02patch117000001",
      "pat_g02patch118000001",
      "pat_g02patch118010001",
      "pat_g02patch118020001",
      "pat_g02patch200000001",
      "pat_g02patch200010001",
      "pat_g02patch200020001",
      "pat_g02patch201000001"
    ],
    "receipts": [
      "rcp_g02patchcatchup2026091001",
      "rcp_m7houseroberts2026091001",
      "rcp_m8aprogression2026091001",
      "rcp_m8bequipment2026091001",
      "rcp_r01equipment2026091001"
    ],
    "strategies": []
  },
  "reviewed_sources": [
    {
      "basis_url": "https://www.copyright.gov/what-is-copyright/",
      "boundary": "Copyright ownership is not an open reuse licence. Retain only the enumerated, newly expressed factual relationships; no copied guide prose, tables, images or source database. Pearl Abyss game IP remains outside the contributor licence. No blanket legal clearance.",
      "decision": "limited_original_factual_extraction",
      "evidence_id": "evd_db435362e5eb93eba7f3eac4",
      "license_status": "publisher_owned",
      "retention_mode": "normalized_facts",
      "url": "https://games.gg/crimson-desert/guides/crimson-desert-all-house-roberts-quests/"
    },
    {
      "basis_url": "https://www.copyright.gov/what-is-copyright/",
      "boundary": "Copyright ownership is not an open reuse licence. Retain only the enumerated, newly expressed factual relationships; no copied guide prose, tables, images or source database. Pearl Abyss game IP remains outside the contributor licence. No blanket legal clearance.",
      "decision": "limited_original_factual_extraction",
      "evidence_id": "evd_43cf07ba816dbe19d270d124",
      "license_status": "publisher_owned",
      "retention_mode": "normalized_facts",
      "url": "https://www.pcgamer.com/games/action/crimson-desert-marnies-excavatron-boss-guide/"
    },
    {
      "basis_url": "https://www.copyright.gov/what-is-copyright/",
      "boundary": "M8A only: selected independently worded entry conditions and rewards for four existing quests. No article prose, tables, images, game files or database extraction. Preserve author/publisher, exact locator and historical uncertainty. Ownership is not an open licence; no blanket rights or gameplay certification. See docs/M8A_PROGRESSION.md.",
      "decision": "limited_original_factual_extraction",
      "evidence_id": "evd_m8aconsolepulse2026091001",
      "license_status": "publisher_owned",
      "retention_mode": "normalized_facts",
      "url": "https://consolepulse.com/multiplatform/crimson-desert/guides/crimson-desert-estate-in-dismay"
    },
    {
      "basis_url": "https://www.copyright.gov/what-is-copyright/",
      "boundary": "M8A only: selected independently worded entry conditions and rewards for four existing quests. No article prose, tables, images, game files or database extraction. Preserve author/publisher, exact locator and historical uncertainty. Ownership is not an open licence; no blanket rights or gameplay certification. See docs/M8A_PROGRESSION.md.",
      "decision": "limited_original_factual_extraction",
      "evidence_id": "evd_m8asealedguide2026091001",
      "license_status": "publisher_owned",
      "retention_mode": "normalized_facts",
      "url": "https://games.gg/crimson-desert/guides/crimson-desert-how-to-complete-sealed-in-stone-quest/"
    },
    {